{
  "$schema": "http://json-schema.org/draft-07/schema#",
  "type": "array",
  "items": {
    "type": "object",
    "required": [
      "course_id",
      "title",
      "level",
      "hours",
      "delivery",
      "keywords",
      "outcomes",
      "access_notes",
      "artifacts",
      "lineage",
      "version",
      "updated"
    ],
    "properties": {
      "course_id": {"type": "string"},
      "title": {"type": "string"},
      "level": {"type": "string"},
      "hours": {"type": "string"},
      "delivery": {"type": "string"},
      "keywords": {"type": "array", "items": {"type": "string"}},
      "outcomes": {"type": "array", "items": {"type": "string"}},
      "access_notes": {"type": "string"},
      "artifacts": {"type": "array", "items": {"type": "string"}},
      "lineage": {"type": "array", "items": {"type": "string"}},
      "version": {"type": "string"},
      "updated": {"type": "string"}
    }
  }
}
