[
  {
    "course_id": "3d-printing-course-3-5",
    "title": "3D Printing Course (Grades 3–5)",
    "level": "Elementary",
    "hours": "11×90 min (16.5h)",
    "delivery": "Studio-Lab",
    "keywords": [
      "3D printing",
      "Tinkercad",
      "Elementary",
      "MakerBot",
      "Empathy"
    ],
    "outcomes": [
      "Model, slice, and print safely from idea to finished object.",
      "Measure in millimeters and manage tolerances through guided builds.",
      "Practice equitable print lab operations and naming conventions.",
      "Design for a partner and iterate based on feedback."
    ],
    "access_notes": "Chromebook-friendly plans with MakerBot Digital Factory workflows and weekly color rotations keep the queue equitable.",
    "artifacts": [
      "Capstone empathy print",
      "Design journal entries",
      "Tolerance toy challenge"
    ],
    "lineage": [
      "Design-for-Printability-and-Function",
      "digital_manufacturing"
    ],
    "version": "2024.06",
    "updated": "2024-06-02"
  },
  {
    "course_id": "advanced-digifab-lab",
    "title": "Advanced Digital Fabrication Lab — Multi-Material, Scanning & G-code Hacks",
    "level": "HS",
    "hours": "14–16 week semester",
    "delivery": "Lab",
    "keywords": [
      "Multi-material",
      "G-code",
      "3D scanning",
      "Print operations",
      "Capstone"
    ],
    "outcomes": [
      "Operate a multi-printer fleet with maintenance and QC routines.",
      "Execute multi-material workflows across MMU, AMS, and manual swaps.",
      "Capture and clean 3D scans for hybrid CAD workflows.",
      "Author, test, and log custom G-code edits for inserts and pauses.",
      "Publish a capstone portfolio documenting operations decisions."
    ],
    "access_notes": "Includes printable checklists, queue logs, and offline docs for labs with limited connectivity.",
    "artifacts": [
      "Multi-material capstone print",
      "Queue and maintenance log",
      "Scanning workflow documentation"
    ],
    "lineage": [
      "Design-for-Printability-and-Function",
      "Engineering-Challenges",
      "digital_manufacturing"
    ],
    "version": "2024.06",
    "updated": "2024-06-02"
  },
  {
    "course_id": "ai-story-society",
    "title": "AI, Story & Society",
    "level": "Mixed",
    "hours": "3 credits",
    "delivery": "Studio-Seminar",
    "keywords": [
      "AI",
      "Story",
      "Ethics"
    ],
    "outcomes": [
      "Interrogate AI narratives across media and history.",
      "Co-write with models while annotating machine contributions.",
      "Map societal impacts and articulate local boundaries.",
      "Prototype publishable zines that cite machine collaborators."
    ],
    "access_notes": "Requires account setup but offers offline prompt decks and small-model alternatives.",
    "artifacts": [
      "Annotated syllabus",
      "Process log",
      "Final storytelling project"
    ],
    "lineage": [
      "future-course-briefs"
    ],
    "version": "2024.06",
    "updated": "2024-06-02"
  },
  {
    "course_id": "art-sculpture-parametric-3d-print",
    "title": "Art, Sculpture & Parametric Patterning in 3D Print",
    "level": "HS",
    "hours": "8-week A/B blocks",
    "delivery": "Studio",
    "keywords": [
      "Parametric",
      "OpenSCAD",
      "Pattern",
      "Vase mode",
      "Critique"
    ],
    "outcomes": [
      "Compose sculptural work with parametric rules and constraint-based thinking.",
      "Translate 2D imagery into 3D patterns using OpenSCAD or p5.js pipelines.",
      "Manipulate slicer parameters to choreograph light, translucency, and texture.",
      "Stage gallery-ready critiques with artist statements and process logs."
    ],
    "access_notes": "Starter files run on low-spec laptops; includes printable critique forms and safety briefs.",
    "artifacts": [
      "Gallery-ready print",
      "Artist statement",
      "Process log zine"
    ],
    "lineage": [
      "Design-for-Printability-and-Function",
      "digital_manufacturing",
      "ImagingOtherwise"
    ],
    "version": "2024.06",
    "updated": "2024-06-02"
  },
  {
    "course_id": "critical-making-civic-media",
    "title": "Critical Making & Civic Media",
    "level": "Undergrad",
    "hours": "3 credits",
    "delivery": "Studio-Seminar",
    "keywords": [
      "Civic",
      "Making",
      "Media"
    ],
    "outcomes": [
      "Hack public narratives through fast prototyping.",
      "Prototype civic media tools for local partners.",
      "Analyze media power structures with collaborative critique.",
      "Document builds for replication and accountability."
    ],
    "access_notes": "Designed for community partnerships; favors low-cost, easily sourced materials.",
    "artifacts": [
      "Course syllabus",
      "Process log",
      "Final civic media action"
    ],
    "lineage": [
      "future-course-briefs"
    ],
    "version": "2024.06",
    "updated": "2024-06-02"
  },
  {
    "course_id": "ctm-sound-design",
    "title": "Sound Design for Theater (CTM Collaborative)",
    "level": "HS",
    "hours": "8×90 min",
    "delivery": "Workshop",
    "keywords": [
      "Sound design",
      "Theater",
      "BandLab",
      "Cue sheets",
      "Collaboration"
    ],
    "outcomes": [
      "Design intentional cues that support live performance beats.",
      "Capture and edit original Foley and atmospheres with accessible gear.",
      "Coordinate playback using shared standby/go language with stage managers.",
      "Document cue stacks, rehearsal notes, and collaboration reflections."
    ],
    "access_notes": "Built for Chromebooks and phones; provides printable cue sheets and offline rehearsal plans.",
    "artifacts": [
      "Cue sheet set",
      "Rehearsal recording",
      "Reflection journal"
    ],
    "lineage": [
      "ExplorationSoundDesign",
      "SoundSystemsSociety",
      "Digital-Music-Control"
    ],
    "version": "2024.06",
    "updated": "2024-06-02"
  },
  {
    "course_id": "design-for-printability-and-function",
    "title": "Design for Printability & Function",
    "level": "MS",
    "hours": "10-week A/B blocks",
    "delivery": "Studio-Lab",
    "keywords": [
      "Printability",
      "OpenSCAD",
      "Tolerance",
      "Functional design",
      "Testing"
    ],
    "outcomes": [
      "Apply printability constraints during CAD planning instead of post-processing.",
      "Prototype snap-fit assemblies with tolerance sweeps and fit gauges.",
      "Analyze slicer parameter effects using structured strength tests.",
      "Deliver a locking container that passes fit, drop, and shake trials."
    ],
    "access_notes": "Dual-licensed content plus CSV templates make LMS uploads and data collection painless.",
    "artifacts": [
      "Printability test artifacts",
      "Design review deck",
      "Capstone locking container"
    ],
    "lineage": [
      "3d-printing-course-3-5",
      "Engineering-Challenges",
      "digital_manufacturing"
    ],
    "version": "2024.06",
    "updated": "2024-06-02"
  },
  {
    "course_id": "digital-imaging-lab",
    "title": "Digital Imaging Lab — Level 1",
    "level": "MS-HS",
    "hours": "12×90 min",
    "delivery": "Studio-Lab",
    "keywords": [
      "Imaging",
      "Photopea",
      "Critical media",
      "Glitch",
      "Exhibition"
    ],
    "outcomes": [
      "Explain pixel-based imaging concepts and manage resolution intentionally.",
      "Capture purposeful photographs with attention to light, framing, and consent.",
      "Edit and composite using layer-based workflows across free tools.",
      "Curate a mini exhibition with artist statements and ethical reflections."
    ],
    "access_notes": "Session files include local notes blocks for hardware constraints and offline adaptation.",
    "artifacts": [
      "Session planning sheets",
      "Anchor project briefs",
      "Mini exhibition plan"
    ],
    "lineage": [
      "ImagingOtherwise",
      "MCADMedia1"
    ],
    "version": "2024.06",
    "updated": "2024-06-02"
  },
  {
    "course_id": "digital-manufacturing",
    "title": "Digital Manufacturing — Studio/Lab",
    "level": "MS-HS",
    "hours": "12 sessions",
    "delivery": "Studio-Lab",
    "keywords": [
      "CNC",
      "3D printing",
      "CAM",
      "Workflow",
      "Posters"
    ],
    "outcomes": [
      "Translate concepts into toolpaths across CNC and additive workflows.",
      "Run guided fabrication sessions while maintaining machine safety routines.",
      "Interpret G-code and slicer profiles to troubleshoot prints and cuts.",
      "Document processes using provided posters, logs, and rubrics."
    ],
    "access_notes": "Ships with ready-to-run Cubiko G-code, Cura profiles, and printable wall posters for low-tech spaces.",
    "artifacts": [
      "Module lesson plans",
      "Machine workflow posters",
      "Student assessment forms"
    ],
    "lineage": [
      "Design-for-Printability-and-Function",
      "Engineering-Challenges"
    ],
    "version": "2024.06",
    "updated": "2024-06-02"
  },
  {
    "course_id": "digital-music-control",
    "title": "Digital Music Control — MOARkNOBS-42 Course Family",
    "level": "Mixed",
    "hours": "3×4-week tracks (2h weekly)",
    "delivery": "Lab-Workshop",
    "keywords": [
      "MIDI",
      "Arduino",
      "Firmware",
      "Controllerism",
      "Performance UX"
    ],
    "outcomes": [
      "Build Arduino-based MIDI controllers through progressive labs.",
      "Structure firmware with modular patterns and reusable classes.",
      "Deploy USB or DIN MIDI outputs with responsive feedback systems.",
      "Document performance UX decisions across maker and studio tracks."
    ],
    "access_notes": "Targets Arduino Uno-class hardware; printable packets support low-connectivity classrooms.",
    "artifacts": [
      "Finished MIDI controller",
      "Firmware repository",
      "Performance mapping worksheet"